{
  "schema": "kisaniti.sensor_reading.v1",
  "device_id": "kn-node-001",
  "boot_id": "3fa9c1e2",
  "seq": 42,
  "measured_at": "2026-10-22T10:05:00.000Z",
  "time_quality": "NTP_SYNCED",
  "uptime_ms": 12603112,
  "temperature_c": 24.51,
  "humidity_pct": 61.27,
  "read_status": "OK",
  "sensor_model": "SHT30",
  "firmware_version": "kn-fw-1.0.0",
  "source_origin": "DEVICE",
  "sample_interval_s": 300,
  "resent": false,
  "dropped_since_boot": 0,
  "reading_id": "kn-node-001:3fa9c1e2:42",
  "received_at": "2026-10-22T10:05:01.204Z",
  "measured_at_trusted": true,
  "temperature_valid": true,
  "humidity_valid": true,
  "ingest_status": "ACCEPTED",
  "quarantine_reason": null,
  "raw_sha256": "9f2c000000000000000000000000000000000000000000000000000000000000",
  "topic": "kisaniti/v1/devices/kn-node-001/telemetry",
  "provenance": {
    "origin": "REAL",
    "source_kind": "SENSOR",
    "source_ref": "device kn-node-001",
    "acquired_at": "2026-10-22T10:05:01.204Z",
    "source_version": "kn-fw-1.0.0"
  }
}
