{
  "schema": "kisaniti.sensor_reading.v1",
  "device_id": "kn-twin-001",
  "boot_id": "3fa9c1e2",
  "seq": 42,
  "measured_at": "2026-10-22T10:05:00.000Z",
  "time_quality": "NTP_SYNCED",
  "uptime_ms": 12603112,
  "temperature_c": 24.51,
  "humidity_pct": 61.27,
  "read_status": "OK",
  "sensor_model": "SHT30",
  "firmware_version": "kn-fw-1.0.0",
  "source_origin": "WOKWI_TWIN",
  "sample_interval_s": 10,
  "resent": false,
  "dropped_since_boot": 0,
  "reading_id": "kn-twin-001:3fa9c1e2:42",
  "received_at": "2026-10-22T10:05:01.204Z",
  "measured_at_trusted": true,
  "temperature_valid": true,
  "humidity_valid": true,
  "ingest_status": "ACCEPTED",
  "quarantine_reason": null,
  "raw_sha256": "9f2c000000000000000000000000000000000000000000000000000000000000",
  "topic": "kisaniti/v1/devices/kn-twin-001/telemetry",
  "provenance": {
    "origin": "SYNTHETIC",
    "source_kind": "SIMULATOR",
    "source_ref": "Wokwi twin kn-twin-001",
    "acquired_at": "2026-10-22T10:05:01.204Z",
    "generator": {
      "script": "firmware (env wokwi) + wokwi/chips/sht3x.chip.c",
      "version": "kn-fw-1.0.0",
      "seed": 0
    }
  }
}
